{
  "assets": [
    {
      "allowed_archive_members": [],
      "asset_id": "fiction-retail-database",
      "dataset_id": "fiction-retail",
      "format": "sqlite",
      "license_evidence_url": "https://raw.githubusercontent.com/datahub-project/static-assets/a6479c691dd2a40dd89563396d9c8b2b28bee83c/datasets/fiction-retail/README.md",
      "license_id": "CC0-1.0",
      "quality_role": "relational-control",
      "sha256": "sha256:9f95373e46219e880ae54f995b6f2c2c439c3746e500e484fe3ab2bf9ac55754",
      "size_bytes": 99655680,
      "source_path": "datasets/fiction-retail/fiction-retail.db",
      "source_url": "https://raw.githubusercontent.com/datahub-project/static-assets/a6479c691dd2a40dd89563396d9c8b2b28bee83c/datasets/fiction-retail/fiction-retail.db",
      "variant": "clean"
    },
    {
      "allowed_archive_members": [],
      "asset_id": "healthcare-database",
      "dataset_id": "healthcare",
      "format": "sqlite",
      "license_evidence_url": "https://raw.githubusercontent.com/datahub-project/static-assets/a6479c691dd2a40dd89563396d9c8b2b28bee83c/datasets/healthcare/README.md",
      "license_id": "CC0-1.0",
      "quality_role": "branch-selective-quality",
      "sha256": "sha256:287a47c53216c2322074ae802976c6c7196e2e17dc77272c6a6bd38af34ec488",
      "size_bytes": 31084544,
      "source_path": "datasets/healthcare/healthcare.db",
      "source_url": "https://raw.githubusercontent.com/datahub-project/static-assets/a6479c691dd2a40dd89563396d9c8b2b28bee83c/datasets/healthcare/healthcare.db",
      "variant": "planted-quality-faults"
    },
    {
      "allowed_archive_members": [],
      "asset_id": "nyc-taxi-clean-database",
      "dataset_id": "nyc-taxi",
      "format": "sqlite",
      "license_evidence_url": "https://raw.githubusercontent.com/datahub-project/static-assets/a6479c691dd2a40dd89563396d9c8b2b28bee83c/datasets/nyc-taxi/README.md",
      "license_id": "LicenseRef-NYC-Public-Domain",
      "quality_role": "freshness-control",
      "sha256": "sha256:fef53dcc005294046da76e0484f099e81d809a05dfa433fe3e38bc1b7f46537d",
      "size_bytes": 90673152,
      "source_path": "datasets/nyc-taxi/nyc_taxi.db",
      "source_url": "https://raw.githubusercontent.com/datahub-project/static-assets/a6479c691dd2a40dd89563396d9c8b2b28bee83c/datasets/nyc-taxi/nyc_taxi.db",
      "variant": "clean"
    },
    {
      "allowed_archive_members": [],
      "asset_id": "nyc-taxi-stale-database",
      "dataset_id": "nyc-taxi",
      "format": "sqlite",
      "license_evidence_url": "https://raw.githubusercontent.com/datahub-project/static-assets/a6479c691dd2a40dd89563396d9c8b2b28bee83c/datasets/nyc-taxi/README.md",
      "license_id": "LicenseRef-NYC-Public-Domain",
      "quality_role": "freshness-fault",
      "sha256": "sha256:35573de0d1d05ffe4e03d3339385da3c69c986539e3d4ef24790a91a054c9871",
      "size_bytes": 90673152,
      "source_path": "datasets/nyc-taxi/nyc_taxi_pipeline.db",
      "source_url": "https://raw.githubusercontent.com/datahub-project/static-assets/a6479c691dd2a40dd89563396d9c8b2b28bee83c/datasets/nyc-taxi/nyc_taxi_pipeline.db",
      "variant": "stale"
    }
  ],
  "resources_page": "https://datahub.devpost.com/resources",
  "schema_version": "dataset-registry/v1",
  "upstream": {
    "repository": "https://github.com/datahub-project/static-assets",
    "revision": "a6479c691dd2a40dd89563396d9c8b2b28bee83c"
  }
}
